{
  "$schema": "../schemas/place.schema.json",
  "id": "domodossola",
  "name": "Domodossola",
  "country": "Italy",
  "format": "A7",
  "center": {
    "lat": 46.1111,
    "lon": 8.297
  },
  "radiusMeters": 1700,
  "visits": {
    "me": [],
    "partner": [],
    "shared": [
      "together"
    ]
  },
  "landmarks": [
    {
      "name": "Piazza Mercato",
      "lat": 46.115977,
      "lon": 8.2911789,
      "art": "art/landmarks/domodossola/piazza-mercato-v1.png",
      "artWidthMm": 5,
      "artDxMm": -3
    },
    {
      "name": "Palazzo Silva",
      "lat": 46.1161755,
      "lon": 8.2905819,
      "art": "art/landmarks/domodossola/palazzo-silva-v1.png",
      "artWidthMm": 4.5,
      "artDxMm": 3
    },
    {
      "name": "Sacro Monte Calvario",
      "lat": 46.1062285,
      "lon": 8.2885789,
      "art": "art/landmarks/domodossola/sacro-monte-calvario-v1.png",
      "artWidthMm": 5.5
    }
  ]
}
